"No.","Time","Time Diff","Source","Destination","Protocol","Length","Info"
"1","0.000000","0.000000","204.79.197.200","172.16.165.165","TCP","60","80  >  49433 [SYN, ACK] Seq=0 Ack=1 Win=64240 Len=0 MSS=1460"
"2","0.000000","0.000000","204.79.197.200","172.16.165.165","TCP","60","80  >  49432 [SYN, ACK] Seq=0 Ack=1 Win=64240 Len=0 MSS=1460"
"3","0.101536","0.101536","204.79.197.200","172.16.165.165","TCP","60","[TCP Retransmission] 80  >  49433 [SYN, ACK] Seq=0 Ack=1 Win=64240 Len=0 MSS=1460"
"4","0.101537","0.000001","204.79.197.200","172.16.165.165","TCP","60","[TCP Retransmission] 80  >  49432 [SYN, ACK] Seq=0 Ack=1 Win=64240 Len=0 MSS=1460"
"5","0.206296","0.104759","204.79.197.200","172.16.165.165","TCP","60","[TCP Retransmission] 80  >  49433 [SYN, ACK] Seq=0 Ack=1 Win=64240 Len=0 MSS=1460"
"6","0.206297","0.000001","204.79.197.200","172.16.165.165","TCP","60","[TCP Retransmission] 80  >  49432 [SYN, ACK] Seq=0 Ack=1 Win=64240 Len=0 MSS=1460"
"7","0.300535","0.094238","204.79.197.200","172.16.165.165","TCP","60","[TCP Retransmission] 80  >  49433 [SYN, ACK] Seq=0 Ack=1 Win=64240 Len=0 MSS=1460"
"8","0.300536","0.000001","204.79.197.200","172.16.165.165","TCP","60","[TCP Retransmission] 80  >  49432 [SYN, ACK] Seq=0 Ack=1 Win=64240 Len=0 MSS=1460"
"9","0.400631","0.100095","204.79.197.200","172.16.165.165","TCP","60","[TCP Retransmission] 80  >  49433 [SYN, ACK] Seq=0 Ack=1 Win=64240 Len=0 MSS=1460"
"10","0.400632","0.000001","204.79.197.200","172.16.165.165","TCP","60","[TCP Retransmission] 80  >  49432 [SYN, ACK] Seq=0 Ack=1 Win=64240 Len=0 MSS=1460"
"11","0.440931","0.040299","131.253.61.84","172.16.165.165","TLSv1","113","Change Cipher Spec, Encrypted Handshake Message"
"12","0.443985","0.003054","172.16.165.165","131.253.61.84","TLSv1","811","Application Data"
"13","0.444204","0.000219","131.253.61.84","172.16.165.165","TCP","60","443  >  49435 [ACK] Seq=60 Ack=758 Win=64240 Len=0"
"14","0.500740","0.056536","204.79.197.200","172.16.165.165","TCP","60","[TCP Retransmission] 80  >  49433 [SYN, ACK] Seq=0 Ack=1 Win=64240 Len=0 MSS=1460"
"15","0.500741","0.000001","204.79.197.200","172.16.165.165","TCP","60","[TCP Retransmission] 80  >  49432 [SYN, ACK] Seq=0 Ack=1 Win=64240 Len=0 MSS=1460"
"16","0.600966","0.100225","204.79.197.200","172.16.165.165","TCP","60","[TCP Retransmission] 80  >  49433 [SYN, ACK] Seq=0 Ack=1 Win=64240 Len=0 MSS=1460"
"17","0.600967","0.000001","204.79.197.200","172.16.165.165","TCP","60","[TCP Retransmission] 80  >  49432 [SYN, ACK] Seq=0 Ack=1 Win=64240 Len=0 MSS=1460"
"18","0.701032","0.100065","204.79.197.200","172.16.165.165","TCP","60","[TCP Retransmission] 80  >  49433 [SYN, ACK] Seq=0 Ack=1 Win=64240 Len=0 MSS=1460"
"19","0.701033","0.000001","204.79.197.200","172.16.165.165","TCP","60","[TCP Retransmission] 80  >  49432 [SYN, ACK] Seq=0 Ack=1 Win=64240 Len=0 MSS=1460"
"20","0.801164","0.100131","204.79.197.200","172.16.165.165","TCP","60","[TCP Retransmission] 80  >  49433 [SYN, ACK] Seq=0 Ack=1 Win=64240 Len=0 MSS=1460"
"21","0.801165","0.000001","204.79.197.200","172.16.165.165","TCP","60","[TCP Retransmission] 80  >  49432 [SYN, ACK] Seq=0 Ack=1 Win=64240 Len=0 MSS=1460"
"22","0.901601","0.100436","204.79.197.200","172.16.165.165","TCP","60","[TCP Retransmission] 80  >  49433 [SYN, ACK] Seq=0 Ack=1 Win=64240 Len=0 MSS=1460"
"23","0.901677","0.000076","204.79.197.200","172.16.165.165","TCP","60","[TCP Retransmission] 80  >  49432 [SYN, ACK] Seq=0 Ack=1 Win=64240 Len=0 MSS=1460"
"24","1.002684","0.101007","204.79.197.200","172.16.165.165","TCP","60","[TCP Retransmission] 80  >  49433 [SYN, ACK] Seq=0 Ack=1 Win=64240 Len=0 MSS=1460"
"25","1.002932","0.000248","204.79.197.200","172.16.165.165","TCP","60","[TCP Retransmission] 80  >  49432 [SYN, ACK] Seq=0 Ack=1 Win=64240 Len=0 MSS=1460"
"26","1.103088","0.100156","204.79.197.200","172.16.165.165","TCP","60","[TCP Retransmission] 80  >  49433 [SYN, ACK] Seq=0 Ack=1 Win=64240 Len=0 MSS=1460"
"27","1.103089","0.000001","204.79.197.200","172.16.165.165","TCP","60","[TCP Retransmission] 80  >  49432 [SYN, ACK] Seq=0 Ack=1 Win=64240 Len=0 MSS=1460"
"28","1.203290","0.100201","204.79.197.200","172.16.165.165","TCP","60","[TCP Retransmission] 80  >  49433 [SYN, ACK] Seq=0 Ack=1 Win=64240 Len=0 MSS=1460"
"29","1.203291","0.000001","204.79.197.200","172.16.165.165","TCP","60","[TCP Retransmission] 80  >  49432 [SYN, ACK] Seq=0 Ack=1 Win=64240 Len=0 MSS=1460"
"30","1.304072","0.100781","204.79.197.200","172.16.165.165","TCP","60","[TCP Retransmission] 80  >  49433 [SYN, ACK] Seq=0 Ack=1 Win=64240 Len=0 MSS=1460"
"31","1.304072","0.000000","204.79.197.200","172.16.165.165","TCP","60","[TCP Retransmission] 80  >  49432 [SYN, ACK] Seq=0 Ack=1 Win=64240 Len=0 MSS=1460"
"32","1.404341","0.100269","204.79.197.200","172.16.165.165","TCP","60","[TCP Retransmission] 80  >  49433 [SYN, ACK] Seq=0 Ack=1 Win=64240 Len=0 MSS=1460"
"33","1.404342","0.000001","204.79.197.200","172.16.165.165","TCP","60","[TCP Retransmission] 80  >  49432 [SYN, ACK] Seq=0 Ack=1 Win=64240 Len=0 MSS=1460"
"34","1.511121","0.106779","204.79.197.200","172.16.165.165","TCP","60","[TCP Retransmission] 80  >  49433 [SYN, ACK] Seq=0 Ack=1 Win=64240 Len=0 MSS=1460"
"35","1.511122","0.000001","204.79.197.200","172.16.165.165","TCP","60","[TCP Retransmission] 80  >  49432 [SYN, ACK] Seq=0 Ack=1 Win=64240 Len=0 MSS=1460"
"36","1.605806","0.094684","204.79.197.200","172.16.165.165","TCP","60","[TCP Retransmission] 80  >  49433 [SYN, ACK] Seq=0 Ack=1 Win=64240 Len=0 MSS=1460"
"37","1.605807","0.000001","204.79.197.200","172.16.165.165","TCP","60","[TCP Retransmission] 80  >  49432 [SYN, ACK] Seq=0 Ack=1 Win=64240 Len=0 MSS=1460"
"38","1.668678","0.062871","131.253.61.84","172.16.165.165","TLSv1","619","Application Data"
"39","1.668709","0.000031","172.16.165.165","131.253.61.84","TCP","54","49435  >  443 [ACK] Seq=758 Ack=626 Win=62916 Len=0"
"40","1.669748","0.001039","172.16.165.165","131.253.61.84","TCP","54","49435  >  443 [FIN, ACK] Seq=758 Ack=626 Win=62916 Len=0"
"41","1.670636","0.000888","131.253.61.84","172.16.165.165","TCP","60","443  >  49435 [ACK] Seq=626 Ack=759 Win=64239 Len=0"
"42","1.670760","0.000124","172.16.165.165","172.16.165.2","DNS","72","Standard query 0xcab7 A ssl.bing.com"
"43","1.706410","0.035650","204.79.197.200","172.16.165.165","TCP","60","[TCP Retransmission] 80  >  49433 [SYN, ACK] Seq=0 Ack=1 Win=64240 Len=0 MSS=1460"
"44","1.706411","0.000001","204.79.197.200","172.16.165.165","TCP","60","[TCP Retransmission] 80  >  49432 [SYN, ACK] Seq=0 Ack=1 Win=64240 Len=0 MSS=1460"
"45","1.806484","0.100073","204.79.197.200","172.16.165.165","TCP","60","[TCP Retransmission] 80  >  49433 [SYN, ACK] Seq=0 Ack=1 Win=64240 Len=0 MSS=1460"
"46","1.806484","0.000000","204.79.197.200","172.16.165.165","TCP","60","[TCP Retransmission] 80  >  49432 [SYN, ACK] Seq=0 Ack=1 Win=64240 Len=0 MSS=1460"
"47","1.906978","0.100494","204.79.197.200","172.16.165.165","TCP","60","[TCP Retransmission] 80  >  49433 [SYN, ACK] Seq=0 Ack=1 Win=64240 Len=0 MSS=1460"
"48","1.906978","0.000000","204.79.197.200","172.16.165.165","TCP","60","[TCP Retransmission] 80  >  49432 [SYN, ACK] Seq=0 Ack=1 Win=64240 Len=0 MSS=1460"
"49","2.007437","0.100459","204.79.197.200","172.16.165.165","TCP","60","[TCP Retransmission] 80  >  49433 [SYN, ACK] Seq=0 Ack=1 Win=64240 Len=0 MSS=1460"
"50","2.007437","0.000000","204.79.197.200","172.16.165.165","TCP","60","[TCP Retransmission] 80  >  49432 [SYN, ACK] Seq=0 Ack=1 Win=64240 Len=0 MSS=1460"
"51","2.020702","0.013265","172.16.165.165","204.79.197.200","TCP","874","49431  >  80 [PSH, ACK] Seq=1 Ack=1 Win=63330 Len=820 [TCP segment of a reassembled PDU]"
"52","2.020811","0.000109","172.16.165.165","204.79.197.200","HTTP/XML","1002","POST /fd/ls/lsp.aspx HTTP/1.1 "
"53","2.020884","0.000073","204.79.197.200","172.16.165.165","TCP","60","80  >  49431 [ACK] Seq=1 Ack=821 Win=64240 Len=0"
"54","2.020884","0.000000","204.79.197.200","172.16.165.165","TCP","60","80  >  49431 [ACK] Seq=1 Ack=1769 Win=64240 Len=0"
"55","2.107396","0.086512","204.79.197.200","172.16.165.165","TCP","60","[TCP Retransmission] 80  >  49433 [SYN, ACK] Seq=0 Ack=1 Win=64240 Len=0 MSS=1460"
"56","2.107397","0.000001","204.79.197.200","172.16.165.165","TCP","60","[TCP Retransmission] 80  >  49432 [SYN, ACK] Seq=0 Ack=1 Win=64240 Len=0 MSS=1460"
"57","2.208377","0.100980","204.79.197.200","172.16.165.165","TCP","60","[TCP Retransmission] 80  >  49433 [SYN, ACK] Seq=0 Ack=1 Win=64240 Len=0 MSS=1460"
"58","2.208378","0.000001","204.79.197.200","172.16.165.165","TCP","60","[TCP Retransmission] 80  >  49432 [SYN, ACK] Seq=0 Ack=1 Win=64240 Len=0 MSS=1460"
"59","2.308926","0.100548","204.79.197.200","172.16.165.165","TCP","60","[TCP Retransmission] 80  >  49433 [SYN, ACK] Seq=0 Ack=1 Win=64240 Len=0 MSS=1460"
"60","2.308927","0.000001","204.79.197.200","172.16.165.165","TCP","60","[TCP Retransmission] 80  >  49432 [SYN, ACK] Seq=0 Ack=1 Win=64240 Len=0 MSS=1460"
"61","2.409408","0.100481","204.79.197.200","172.16.165.165","TCP","60","[TCP Retransmission] 80  >  49433 [SYN, ACK] Seq=0 Ack=1 Win=64240 Len=0 MSS=1460"
"62","2.409409","0.000001","204.79.197.200","172.16.165.165","TCP","60","[TCP Retransmission] 80  >  49432 [SYN, ACK] Seq=0 Ack=1 Win=64240 Len=0 MSS=1460"
"63","2.510397","0.100988","204.79.197.200","172.16.165.165","TCP","60","[TCP Retransmission] 80  >  49433 [SYN, ACK] Seq=0 Ack=1 Win=64240 Len=0 MSS=1460"
"64","2.510398","0.000001","204.79.197.200","172.16.165.165","TCP","60","[TCP Retransmission] 80  >  49432 [SYN, ACK] Seq=0 Ack=1 Win=64240 Len=0 MSS=1460"
"65","2.590691","0.080293","172.16.165.2","172.16.165.165","DNS","148","Standard query response 0xcab7 A ssl.bing.com CNAME ssl-bing-com.a-0001.a-msedge.net CNAME a-0001.a-msedge.net A 204.79.197.200"
"66","2.591091","0.000400","172.16.165.165","204.79.197.200","TCP","66","49436  >  443 [SYN] Seq=0 Win=8192 Len=0 MSS=1460 WS=4 SACK_PERM=1"
"67","2.610502","0.019411","204.79.197.200","172.16.165.165","TCP","60","[TCP Retransmission] 80  >  49433 [SYN, ACK] Seq=0 Ack=1 Win=64240 Len=0 MSS=1460"
"68","2.610502","0.000000","204.79.197.200","172.16.165.165","TCP","60","[TCP Retransmission] 80  >  49432 [SYN, ACK] Seq=0 Ack=1 Win=64240 Len=0 MSS=1460"
"69","2.711564","0.101062","204.79.197.200","172.16.165.165","TCP","60","[TCP Retransmission] 80  >  49433 [SYN, ACK] Seq=0 Ack=1 Win=64240 Len=0 MSS=1460"
"70","2.711695","0.000131","204.79.197.200","172.16.165.165","TCP","60","[TCP Retransmission] 80  >  49432 [SYN, ACK] Seq=0 Ack=1 Win=64240 Len=0 MSS=1460"
"71","2.812174","0.100479","204.79.197.200","172.16.165.165","TCP","60","[TCP Retransmission] 80  >  49433 [SYN, ACK] Seq=0 Ack=1 Win=64240 Len=0 MSS=1460"
"72","2.812175","0.000001","204.79.197.200","172.16.165.165","TCP","60","[TCP Retransmission] 80  >  49432 [SYN, ACK] Seq=0 Ack=1 Win=64240 Len=0 MSS=1460"
"73","2.913033","0.100858","204.79.197.200","172.16.165.165","TCP","60","[TCP Retransmission] 80  >  49433 [SYN, ACK] Seq=0 Ack=1 Win=64240 Len=0 MSS=1460"
"74","2.913034","0.000001","204.79.197.200","172.16.165.165","TCP","60","[TCP Retransmission] 80  >  49432 [SYN, ACK] Seq=0 Ack=1 Win=64240 Len=0 MSS=1460"
"75","3.014066","0.101032","204.79.197.200","172.16.165.165","TCP","60","[TCP Retransmission] 80  >  49433 [SYN, ACK] Seq=0 Ack=1 Win=64240 Len=0 MSS=1460"
"76","3.015003","0.000937","204.79.197.200","172.16.165.165","TCP","60","[TCP Retransmission] 80  >  49432 [SYN, ACK] Seq=0 Ack=1 Win=64240 Len=0 MSS=1460"
"77","3.115081","0.100078","204.79.197.200","172.16.165.165","TCP","60","[TCP Retransmission] 80  >  49433 [SYN, ACK] Seq=0 Ack=1 Win=64240 Len=0 MSS=1460"
"78","3.115082","0.000001","204.79.197.200","172.16.165.165","TCP","60","[TCP Retransmission] 80  >  49432 [SYN, ACK] Seq=0 Ack=1 Win=64240 Len=0 MSS=1460"
"79","3.215862","0.100780","204.79.197.200","172.16.165.165","TCP","60","[TCP Retransmission] 80  >  49433 [SYN, ACK] Seq=0 Ack=1 Win=64240 Len=0 MSS=1460"
"80","3.215862","0.000000","204.79.197.200","172.16.165.165","TCP","60","[TCP Retransmission] 80  >  49432 [SYN, ACK] Seq=0 Ack=1 Win=64240 Len=0 MSS=1460"
"81","3.316125","0.100263","204.79.197.200","172.16.165.165","TCP","60","[TCP Retransmission] 80  >  49433 [SYN, ACK] Seq=0 Ack=1 Win=64240 Len=0 MSS=1460"
"82","3.316126","0.000001","204.79.197.200","172.16.165.165","TCP","60","[TCP Retransmission] 80  >  49432 [SYN, ACK] Seq=0 Ack=1 Win=64240 Len=0 MSS=1460"
"83","3.416623","0.100497","204.79.197.200","172.16.165.165","TCP","60","[TCP Retransmission] 80  >  49433 [SYN, ACK] Seq=0 Ack=1 Win=64240 Len=0 MSS=1460"
"84","3.416624","0.000001","204.79.197.200","172.16.165.165","TCP","60","[TCP Retransmission] 80  >  49432 [SYN, ACK] Seq=0 Ack=1 Win=64240 Len=0 MSS=1460"
"85","3.512388","0.095764","204.79.197.200","172.16.165.165","TCP","60","443  >  49436 [SYN, ACK] Seq=0 Ack=1 Win=64240 Len=0 MSS=1460"
"86","3.512489","0.000101","172.16.165.165","204.79.197.200","TCP","54","49436  >  443 [ACK] Seq=1 Ack=1 Win=64240 Len=0"
"87","3.512628","0.000139","204.79.197.200","172.16.165.165","HTTP","324","HTTP/1.1 204 No Content "
"88","3.513578","0.000950","172.16.165.165","204.79.197.200","SSLv2","126","Client Hello"
"89","3.514406","0.000828","204.79.197.200","172.16.165.165","TCP","60","443  >  49436 [ACK] Seq=1 Ack=73 Win=64240 Len=0"
"90","3.516600","0.002194","204.79.197.200","172.16.165.165","TCP","60","[TCP Retransmission] 80  >  49433 [SYN, ACK] Seq=0 Ack=1 Win=64240 Len=0 MSS=1460"
"91","3.516600","0.000000","204.79.197.200","172.16.165.165","TCP","60","[TCP Retransmission] 80  >  49432 [SYN, ACK] Seq=0 Ack=1 Win=64240 Len=0 MSS=1460"
"92","3.612602","0.096002","204.79.197.200","172.16.165.165","TCP","324","[TCP Retransmission] 80  >  49431 [PSH, ACK] Seq=1 Ack=1769 Win=64240 Len=270"
"93","3.612625","0.000023","172.16.165.165","204.79.197.200","TCP","54","49431  >  80 [ACK] Seq=1769 Ack=271 Win=63060 Len=0"
"94","3.616587","0.003962","204.79.197.200","172.16.165.165","TCP","60","[TCP Retransmission] 80  >  49433 [SYN, ACK] Seq=0 Ack=1 Win=64240 Len=0 MSS=1460"
"95","3.616587","0.000000","204.79.197.200","172.16.165.165","TCP","60","[TCP Retransmission] 80  >  49432 [SYN, ACK] Seq=0 Ack=1 Win=64240 Len=0 MSS=1460"
"96","3.716863","0.100276","204.79.197.200","172.16.165.165","TCP","60","[TCP Retransmission] 80  >  49433 [SYN, ACK] Seq=0 Ack=1 Win=64240 Len=0 MSS=1460"
"97","3.716864","0.000001","204.79.197.200","172.16.165.165","TCP","60","[TCP Retransmission] 80  >  49432 [SYN, ACK] Seq=0 Ack=1 Win=64240 Len=0 MSS=1460"
"98","3.764152","0.047288","fe80::8db6:2c7:a019:4d88","ff02::1:2","DHCPv6","154","Solicit XID: 0xe1700d CID: 000100011ae542f7000c2932e267 "
"99","3.816715","0.052563","204.79.197.200","172.16.165.165","TCP","60","[TCP Retransmission] 80  >  49433 [SYN, ACK] Seq=0 Ack=1 Win=64240 Len=0 MSS=1460"
"100","3.816716","0.000001","204.79.197.200","172.16.165.165","TCP","60","[TCP Retransmission] 80  >  49432 [SYN, ACK] Seq=0 Ack=1 Win=64240 Len=0 MSS=1460"
"101","3.917810","0.101094","204.79.197.200","172.16.165.165","TCP","60","[TCP Retransmission] 80  >  49433 [SYN, ACK] Seq=0 Ack=1 Win=64240 Len=0 MSS=1460"
"102","3.917811","0.000001","204.79.197.200","172.16.165.165","TCP","60","[TCP Retransmission] 80  >  49432 [SYN, ACK] Seq=0 Ack=1 Win=64240 Len=0 MSS=1460"
"103","4.017968","0.100157","204.79.197.200","172.16.165.165","TCP","60","[TCP Retransmission] 80  >  49433 [SYN, ACK] Seq=0 Ack=1 Win=64240 Len=0 MSS=1460"
"104","4.017969","0.000001","204.79.197.200","172.16.165.165","TCP","60","[TCP Retransmission] 80  >  49432 [SYN, ACK] Seq=0 Ack=1 Win=64240 Len=0 MSS=1460"
"105","4.118090","0.100121","204.79.197.200","172.16.165.165","TCP","60","[TCP Retransmission] 80  >  49433 [SYN, ACK] Seq=0 Ack=1 Win=64240 Len=0 MSS=1460"
"106","4.118091","0.000001","204.79.197.200","172.16.165.165","TCP","60","[TCP Retransmission] 80  >  49432 [SYN, ACK] Seq=0 Ack=1 Win=64240 Len=0 MSS=1460"
"107","4.218187","0.100096","204.79.197.200","172.16.165.165","TCP","60","[TCP Retransmission] 80  >  49433 [SYN, ACK] Seq=0 Ack=1 Win=64240 Len=0 MSS=1460"
"108","4.218188","0.000001","204.79.197.200","172.16.165.165","TCP","60","[TCP Retransmission] 80  >  49432 [SYN, ACK] Seq=0 Ack=1 Win=64240 Len=0 MSS=1460"
"109","4.237852","0.019664","172.16.165.165","204.79.197.200","HTTP","861","GET /fd/ls/GLinkPing.aspx?IG=aee5908ea2d64991aa8b8996fd170a75&&ID=SERP,5091.1 HTTP/1.1 "
"110","4.238029","0.000177","204.79.197.200","172.16.165.165","TCP","60","80  >  49429 [ACK] Seq=1 Ack=808 Win=64240 Len=0"
"111","4.311646","0.073617","204.79.197.200","172.16.165.165","TCP","1409","443  >  49436 [PSH, ACK] Seq=1 Ack=73 Win=64240 Len=1355 [TCP segment of a reassembled PDU]"
"112","4.318171","0.006525","204.79.197.200","172.16.165.165","TCP","60","[TCP Retransmission] 80  >  49433 [SYN, ACK] Seq=0 Ack=1 Win=64240 Len=0 MSS=1460"
"113","4.318172","0.000001","204.79.197.200","172.16.165.165","TCP","60","[TCP Retransmission] 80  >  49432 [SYN, ACK] Seq=0 Ack=1 Win=64240 Len=0 MSS=1460"
"114","4.345949","0.027777","172.16.165.165","204.79.197.200","TCP","54","49436  >  443 [FIN, ACK] Seq=73 Ack=1356 Win=62885 Len=0"
"115","4.346546","0.000597","204.79.197.200","172.16.165.165","TCP","60","443  >  49436 [ACK] Seq=1356 Ack=74 Win=64239 Len=0"
"116","4.361159","0.014613","172.16.165.165","172.16.165.2","DNS","78","Standard query 0x1db1 A www.ciniholland.nl"
"117","4.417204","0.056045","204.79.197.200","172.16.165.165","TCP","60","[TCP Retransmission] 80  >  49433 [SYN, ACK] Seq=0 Ack=1 Win=64240 Len=0 MSS=1460"
"118","4.417205","0.000001","204.79.197.200","172.16.165.165","TCP","60","[TCP Retransmission] 80  >  49432 [SYN, ACK] Seq=0 Ack=1 Win=64240 Len=0 MSS=1460"
"119","4.475182","0.057977","204.79.197.200","172.16.165.165","TCP","60","[TCP Retransmission] 80  >  49433 [SYN, ACK] Seq=0 Ack=1 Win=64240 Len=0 MSS=1460"
"120","4.475184","0.000002","204.79.197.200","172.16.165.165","TCP","60","[TCP Retransmission] 80  >  49432 [SYN, ACK] Seq=0 Ack=1 Win=64240 Len=0 MSS=1460"
"121","4.594887","0.119703","204.79.197.200","172.16.165.165","TCP","1514","443  >  49436 [ACK] Seq=1356 Ack=74 Win=64239 Len=1460 [TCP segment of a reassembled PDU]"
"122","4.594888","0.000001","204.79.197.200","172.16.165.165","TLSv1","598","Server Hello, Certificate, Server Key Exchange, Server Hello Done"
"123","4.594944","0.000056","172.16.165.165","204.79.197.200","TCP","54","49436  >  443 [RST, ACK] Seq=74 Ack=2816 Win=0 Len=0"
"124","4.618826","0.023882","204.79.197.200","172.16.165.165","TCP","60","[TCP Retransmission] 80  >  49433 [SYN, ACK] Seq=0 Ack=1 Win=64240 Len=0 MSS=1460"
"125","4.618827","0.000001","204.79.197.200","172.16.165.165","TCP","60","[TCP Retransmission] 80  >  49432 [SYN, ACK] Seq=0 Ack=1 Win=64240 Len=0 MSS=1460"
"126","4.719875","0.101048","204.79.197.200","172.16.165.165","TCP","60","[TCP Retransmission] 80  >  49433 [SYN, ACK] Seq=0 Ack=1 Win=64240 Len=0 MSS=1460"
"127","4.719876","0.000001","204.79.197.200","172.16.165.165","TCP","60","[TCP Retransmission] 80  >  49432 [SYN, ACK] Seq=0 Ack=1 Win=64240 Len=0 MSS=1460"
"128","4.820928","0.101052","204.79.197.200","172.16.165.165","TCP","60","[TCP Retransmission] 80  >  49433 [SYN, ACK] Seq=0 Ack=1 Win=64240 Len=0 MSS=1460"
"129","4.820929","0.000001","204.79.197.200","172.16.165.165","TCP","60","[TCP Retransmission] 80  >  49432 [SYN, ACK] Seq=0 Ack=1 Win=64240 Len=0 MSS=1460"
"130","4.883832","0.062903","204.79.197.200","172.16.165.165","HTTP","462","HTTP/1.1 200 OK  (GIF89a)"
"131","4.921249","0.037417","204.79.197.200","172.16.165.165","TCP","60","[TCP Retransmission] 80  >  49433 [SYN, ACK] Seq=0 Ack=1 Win=64240 Len=0 MSS=1460"
"132","4.921251","0.000002","204.79.197.200","172.16.165.165","TCP","60","[TCP Retransmission] 80  >  49432 [SYN, ACK] Seq=0 Ack=1 Win=64240 Len=0 MSS=1460"
"133","4.983881","0.062630","204.79.197.200","172.16.165.165","TCP","462","[TCP Retransmission] 80  >  49429 [PSH, ACK] Seq=1 Ack=808 Win=64240 Len=408"
"134","4.983902","0.000021","172.16.165.165","204.79.197.200","TCP","54","49429  >  80 [ACK] Seq=808 Ack=409 Win=63832 Len=0"
"135","5.021797","0.037895","204.79.197.200","172.16.165.165","TCP","60","[TCP Retransmission] 80  >  49433 [SYN, ACK] Seq=0 Ack=1 Win=64240 Len=0 MSS=1460"
"136","5.021798","0.000001","204.79.197.200","172.16.165.165","TCP","60","[TCP Retransmission] 80  >  49432 [SYN, ACK] Seq=0 Ack=1 Win=64240 Len=0 MSS=1460"
"137","5.121860","0.100062","204.79.197.200","172.16.165.165","TCP","60","[TCP Retransmission] 80  >  49433 [SYN, ACK] Seq=0 Ack=1 Win=64240 Len=0 MSS=1460"
"138","5.121860","0.000000","204.79.197.200","172.16.165.165","TCP","60","[TCP Retransmission] 80  >  49432 [SYN, ACK] Seq=0 Ack=1 Win=64240 Len=0 MSS=1460"
"139","5.169421","0.047561","172.16.165.2","172.16.165.165","DNS","94","Standard query response 0x1db1 A www.ciniholland.nl A 82.150.140.30"
"140","5.170000","0.000579","172.16.165.165","82.150.140.30","TCP","66","49437  >  80 [SYN] Seq=0 Win=8192 Len=0 MSS=1460 WS=4 SACK_PERM=1"
"141","5.221857","0.051857","204.79.197.200","172.16.165.165","TCP","60","[TCP Retransmission] 80  >  49433 [SYN, ACK] Seq=0 Ack=1 Win=64240 Len=0 MSS=1460"
"142","5.221857","0.000000","204.79.197.200","172.16.165.165","TCP","60","[TCP Retransmission] 80  >  49432 [SYN, ACK] Seq=0 Ack=1 Win=64240 Len=0 MSS=1460"
"143","5.322359","0.100502","204.79.197.200","172.16.165.165","TCP","60","[TCP Retransmission] 80  >  49433 [SYN, ACK] Seq=0 Ack=1 Win=64240 Len=0 MSS=1460"
"144","5.322360","0.000001","204.79.197.200","172.16.165.165","TCP","60","[TCP Retransmission] 80  >  49432 [SYN, ACK] Seq=0 Ack=1 Win=64240 Len=0 MSS=1460"
"145","5.422656","0.100296","204.79.197.200","172.16.165.165","TCP","60","[TCP Retransmission] 80  >  49433 [SYN, ACK] Seq=0 Ack=1 Win=64240 Len=0 MSS=1460"
"146","5.422657","0.000001","204.79.197.200","172.16.165.165","TCP","60","[TCP Retransmission] 80  >  49432 [SYN, ACK] Seq=0 Ack=1 Win=64240 Len=0 MSS=1460"
"147","5.523051","0.100394","204.79.197.200","172.16.165.165","TCP","60","[TCP Retransmission] 80  >  49433 [SYN, ACK] Seq=0 Ack=1 Win=64240 Len=0 MSS=1460"
"148","5.523051","0.000000","204.79.197.200","172.16.165.165","TCP","60","[TCP Retransmission] 80  >  49432 [SYN, ACK] Seq=0 Ack=1 Win=64240 Len=0 MSS=1460"
"149","5.623539","0.100488","204.79.197.200","172.16.165.165","TCP","60","[TCP Retransmission] 80  >  49433 [SYN, ACK] Seq=0 Ack=1 Win=64240 Len=0 MSS=1460"
"150","5.623540","0.000001","204.79.197.200","172.16.165.165","TCP","60","[TCP Retransmission] 80  >  49432 [SYN, ACK] Seq=0 Ack=1 Win=64240 Len=0 MSS=1460"
"151","5.723651","0.100111","204.79.197.200","172.16.165.165","TCP","60","[TCP Retransmission] 80  >  49433 [SYN, ACK] Seq=0 Ack=1 Win=64240 Len=0 MSS=1460"
"152","5.723652","0.000001","204.79.197.200","172.16.165.165","TCP","60","[TCP Retransmission] 80  >  49432 [SYN, ACK] Seq=0 Ack=1 Win=64240 Len=0 MSS=1460"
"153","5.824777","0.101125","204.79.197.200","172.16.165.165","TCP","60","[TCP Retransmission] 80  >  49433 [SYN, ACK] Seq=0 Ack=1 Win=64240 Len=0 MSS=1460"
"154","5.824778","0.000001","204.79.197.200","172.16.165.165","TCP","60","[TCP Retransmission] 80  >  49432 [SYN, ACK] Seq=0 Ack=1 Win=64240 Len=0 MSS=1460"
"155","5.925818","0.101040","204.79.197.200","172.16.165.165","TCP","60","[TCP Retransmission] 80  >  49433 [SYN, ACK] Seq=0 Ack=1 Win=64240 Len=0 MSS=1460"
"156","5.925943","0.000125","204.79.197.200","172.16.165.165","TCP","60","[TCP Retransmission] 80  >  49432 [SYN, ACK] Seq=0 Ack=1 Win=64240 Len=0 MSS=1460"
"157","6.026941","0.100998","204.79.197.200","172.16.165.165","TCP","60","[TCP Retransmission] 80  >  49433 [SYN, ACK] Seq=0 Ack=1 Win=64240 Len=0 MSS=1460"
"158","6.026942","0.000001","204.79.197.200","172.16.165.165","TCP","60","[TCP Retransmission] 80  >  49432 [SYN, ACK] Seq=0 Ack=1 Win=64240 Len=0 MSS=1460"
"159","6.072308","0.045366","82.150.140.30","172.16.165.165","TCP","60","80  >  49437 [SYN, ACK] Seq=0 Ack=1 Win=64240 Len=0 MSS=1460"
"160","6.072349","0.000041","172.16.165.165","82.150.140.30","TCP","54","49437  >  80 [ACK] Seq=1 Ack=1 Win=64240 Len=0"
"161","6.073686","0.001337","172.16.165.165","82.150.140.30","HTTP","621","GET / HTTP/1.1 "
"162","6.073791","0.000105","82.150.140.30","172.16.165.165","TCP","60","80  >  49437 [ACK] Seq=1 Ack=568 Win=64240 Len=0"
"163","6.127175","0.053384","204.79.197.200","172.16.165.165","TCP","60","[TCP Retransmission] 80  >  49433 [SYN, ACK] Seq=0 Ack=1 Win=64240 Len=0 MSS=1460"
"164","6.127176","0.000001","204.79.197.200","172.16.165.165","TCP","60","[TCP Retransmission] 80  >  49432 [SYN, ACK] Seq=0 Ack=1 Win=64240 Len=0 MSS=1460"
"165","6.227272","0.100096","204.79.197.200","172.16.165.165","TCP","60","[TCP Retransmission] 80  >  49433 [SYN, ACK] Seq=0 Ack=1 Win=64240 Len=0 MSS=1460"
"166","6.227273","0.000001","204.79.197.200","172.16.165.165","TCP","60","[TCP Retransmission] 80  >  49432 [SYN, ACK] Seq=0 Ack=1 Win=64240 Len=0 MSS=1460"
"167","6.329786","0.102513","204.79.197.200","172.16.165.165","TCP","60","[TCP Retransmission] 80  >  49433 [SYN, ACK] Seq=0 Ack=1 Win=64240 Len=0 MSS=1460"
"168","6.329787","0.000001","204.79.197.200","172.16.165.165","TCP","60","[TCP Retransmission] 80  >  49432 [SYN, ACK] Seq=0 Ack=1 Win=64240 Len=0 MSS=1460"
"169","6.427831","0.098044","204.79.197.200","172.16.165.165","TCP","60","[TCP Retransmission] 80  >  49433 [SYN, ACK] Seq=0 Ack=1 Win=64240 Len=0 MSS=1460"
"170","6.427832","0.000001","204.79.197.200","172.16.165.165","TCP","60","[TCP Retransmission] 80  >  49432 [SYN, ACK] Seq=0 Ack=1 Win=64240 Len=0 MSS=1460"
"171","6.528060","0.100228","204.79.197.200","172.16.165.165","TCP","60","[TCP Retransmission] 80  >  49433 [SYN, ACK] Seq=0 Ack=1 Win=64240 Len=0 MSS=1460"
"172","6.528060","0.000000","204.79.197.200","172.16.165.165","TCP","60","[TCP Retransmission] 80  >  49432 [SYN, ACK] Seq=0 Ack=1 Win=64240 Len=0 MSS=1460"
"173","6.628669","0.100609","204.79.197.200","172.16.165.165","TCP","60","[TCP Retransmission] 80  >  49433 [SYN, ACK] Seq=0 Ack=1 Win=64240 Len=0 MSS=1460"
"174","6.628671","0.000002","204.79.197.200","172.16.165.165","TCP","60","[TCP Retransmission] 80  >  49432 [SYN, ACK] Seq=0 Ack=1 Win=64240 Len=0 MSS=1460"
"175","6.729655","0.100984","204.79.197.200","172.16.165.165","TCP","60","[TCP Retransmission] 80  >  49433 [SYN, ACK] Seq=0 Ack=1 Win=64240 Len=0 MSS=1460"
"176","6.729655","0.000000","204.79.197.200","172.16.165.165","TCP","60","[TCP Retransmission] 80  >  49432 [SYN, ACK] Seq=0 Ack=1 Win=64240 Len=0 MSS=1460"
"177","6.829852","0.100197","204.79.197.200","172.16.165.165","TCP","60","[TCP Retransmission] 80  >  49433 [SYN, ACK] Seq=0 Ack=1 Win=64240 Len=0 MSS=1460"
"178","6.829852","0.000000","204.79.197.200","172.16.165.165","TCP","60","[TCP Retransmission] 80  >  49432 [SYN, ACK] Seq=0 Ack=1 Win=64240 Len=0 MSS=1460"
"179","6.861187","0.031335","82.150.140.30","172.16.165.165","TCP","1409","80  >  49437 [PSH, ACK] Seq=1 Ack=568 Win=64240 Len=1355 [TCP segment of a reassembled PDU]"
"180","6.861241","0.000054","82.150.140.30","172.16.165.165","TCP","1409","80  >  49437 [PSH, ACK] Seq=1356 Ack=568 Win=64240 Len=1355 [TCP segment of a reassembled PDU]"
"181","6.861253","0.000012","172.16.165.165","82.150.140.30","TCP","54","49437  >  80 [ACK] Seq=568 Ack=2711 Win=64240 Len=0"
"182","6.862035","0.000782","82.150.140.30","172.16.165.165","TCP","1409","80  >  49437 [PSH, ACK] Seq=2711 Ack=568 Win=64240 Len=1355 [TCP segment of a reassembled PDU]"
"183","6.862496","0.000461","82.150.140.30","172.16.165.165","TCP","1409","80  >  49437 [PSH, ACK] Seq=4066 Ack=568 Win=64240 Len=1355 [TCP segment of a reassembled PDU]"
"184","6.862508","0.000012","172.16.165.165","82.150.140.30","TCP","54","49437  >  80 [ACK] Seq=568 Ack=5421 Win=64240 Len=0"
"185","6.863214","0.000706","82.150.140.30","172.16.165.165","TCP","1514","80  >  49437 [ACK] Seq=5421 Ack=568 Win=64240 Len=1460 [TCP segment of a reassembled PDU]"
"186","6.863214","0.000000","82.150.140.30","172.16.165.165","TCP","1304","80  >  49437 [PSH, ACK] Seq=6881 Ack=568 Win=64240 Len=1250 [TCP segment of a reassembled PDU]"
"187","6.863227","0.000013","172.16.165.165","82.150.140.30","TCP","54","49437  >  80 [ACK] Seq=568 Ack=8131 Win=64240 Len=0"
"188","6.870293","0.007066","172.16.165.165","82.150.140.30","TCP","66","49438  >  80 [SYN] Seq=0 Win=8192 Len=0 MSS=1460 WS=4 SACK_PERM=1"
"189","6.870516","0.000223","172.16.165.165","82.150.140.30","TCP","66","49439  >  80 [SYN] Seq=0 Win=8192 Len=0 MSS=1460 WS=4 SACK_PERM=1"
"190","6.870750","0.000234","172.16.165.165","82.150.140.30","TCP","66","49440  >  80 [SYN] Seq=0 Win=8192 Len=0 MSS=1460 WS=4 SACK_PERM=1"
"191","6.871041","0.000291","172.16.165.165","82.150.140.30","TCP","66","49441  >  80 [SYN] Seq=0 Win=8192 Len=0 MSS=1460 WS=4 SACK_PERM=1"
"192","6.871194","0.000153","172.16.165.165","82.150.140.30","TCP","66","49442  >  80 [SYN] Seq=0 Win=8192 Len=0 MSS=1460 WS=4 SACK_PERM=1"
"193","6.871470","0.000276","172.16.165.165","172.16.165.2","DNS","71","Standard query 0x799d A adultbiz.in"
"194","6.930436","0.058966","204.79.197.200","172.16.165.165","TCP","60","[TCP Retransmission] 80  >  49433 [SYN, ACK] Seq=0 Ack=1 Win=64240 Len=0 MSS=1460"
"195","6.930628","0.000192","204.79.197.200","172.16.165.165","TCP","60","[TCP Retransmission] 80  >  49432 [SYN, ACK] Seq=0 Ack=1 Win=64240 Len=0 MSS=1460"
"196","7.008797","0.078169","82.150.140.30","172.16.165.165","TCP","1409","80  >  49437 [PSH, ACK] Seq=8131 Ack=568 Win=64240 Len=1355 [TCP segment of a reassembled PDU]"
"197","7.009159","0.000362","82.150.140.30","172.16.165.165","TCP","1409","80  >  49437 [PSH, ACK] Seq=9486 Ack=568 Win=64240 Len=1355 [TCP segment of a reassembled PDU]"
"198","7.009175","0.000016","172.16.165.165","82.150.140.30","TCP","54","49437  >  80 [ACK] Seq=568 Ack=10841 Win=64240 Len=0"
"199","7.009257","0.000082","82.150.140.30","172.16.165.165","TCP","1514","80  >  49437 [ACK] Seq=10841 Ack=568 Win=64240 Len=1460 [TCP segment of a reassembled PDU]"
"200","7.009258","0.000001","82.150.140.30","172.16.165.165","TCP","1304","80  >  49437 [PSH, ACK] Seq=12301 Ack=568 Win=64240 Len=1250 [TCP segment of a reassembled PDU]"
"201","7.009266","0.000008","172.16.165.165","82.150.140.30","TCP","54","49437  >  80 [ACK] Seq=568 Ack=13551 Win=64240 Len=0"
"202","7.030281","0.021015","204.79.197.200","172.16.165.165","TCP","60","[TCP Retransmission] 80  >  49433 [SYN, ACK] Seq=0 Ack=1 Win=64240 Len=0 MSS=1460"
"203","7.030282","0.000001","204.79.197.200","172.16.165.165","TCP","60","[TCP Retransmission] 80  >  49432 [SYN, ACK] Seq=0 Ack=1 Win=64240 Len=0 MSS=1460"
"204","7.131356","0.101074","204.79.197.200","172.16.165.165","TCP","60","[TCP Retransmission] 80  >  49433 [SYN, ACK] Seq=0 Ack=1 Win=64240 Len=0 MSS=1460"
"205","7.131357","0.000001","204.79.197.200","172.16.165.165","TCP","60","[TCP Retransmission] 80  >  49432 [SYN, ACK] Seq=0 Ack=1 Win=64240 Len=0 MSS=1460"
"206","7.232126","0.100769","204.79.197.200","172.16.165.165","TCP","60","[TCP Retransmission] 80  >  49433 [SYN, ACK] Seq=0 Ack=1 Win=64240 Len=0 MSS=1460"
"207","7.232128","0.000002","204.79.197.200","172.16.165.165","TCP","60","[TCP Retransmission] 80  >  49432 [SYN, ACK] Seq=0 Ack=1 Win=64240 Len=0 MSS=1460"
"208","7.330018","0.097890","82.150.140.30","172.16.165.165","TCP","1409","80  >  49437 [PSH, ACK] Seq=13551 Ack=568 Win=64240 Len=1355 [TCP segment of a reassembled PDU]"
"209","7.330481","0.000463","82.150.140.30","172.16.165.165","TCP","1514","80  >  49437 [ACK] Seq=14906 Ack=568 Win=64240 Len=1460 [TCP segment of a reassembled PDU]"
"210","7.330481","0.000000","82.150.140.30","172.16.165.165","TCP","1304","80  >  49437 [PSH, ACK] Seq=16366 Ack=568 Win=64240 Len=1250 [TCP segment of a reassembled PDU]"
"211","7.330493","0.000012","172.16.165.165","82.150.140.30","TCP","54","49437  >  80 [ACK] Seq=568 Ack=17616 Win=64240 Len=0"
"212","7.332044","0.001551","204.79.197.200","172.16.165.165","TCP","60","[TCP Retransmission] 80  >  49433 [SYN, ACK] Seq=0 Ack=1 Win=64240 Len=0 MSS=1460"
"213","7.332045","0.000001","204.79.197.200","172.16.165.165","TCP","60","[TCP Retransmission] 80  >  49432 [SYN, ACK] Seq=0 Ack=1 Win=64240 Len=0 MSS=1460"
"214","7.432291","0.100246","204.79.197.200","172.16.165.165","TCP","60","[TCP Retransmission] 80  >  49433 [SYN, ACK] Seq=0 Ack=1 Win=64240 Len=0 MSS=1460"
"215","7.432375","0.000084","204.79.197.200","172.16.165.165","TCP","60","[TCP Retransmission] 80  >  49432 [SYN, ACK] Seq=0 Ack=1 Win=64240 Len=0 MSS=1460"
"216","7.482062","0.049687","82.150.140.30","172.16.165.165","TCP","1409","80  >  49437 [PSH, ACK] Seq=17616 Ack=568 Win=64240 Len=1355 [TCP segment of a reassembled PDU]"
"217","7.482437","0.000375","82.150.140.30","172.16.165.165","TCP","1409","80  >  49437 [PSH, ACK] Seq=18971 Ack=568 Win=64240 Len=1355 [TCP segment of a reassembled PDU]"
"218","7.482456","0.000019","172.16.165.165","82.150.140.30","TCP","54","49437  >  80 [ACK] Seq=568 Ack=20326 Win=64240 Len=0"
"219","7.484079","0.001623","82.150.140.30","172.16.165.165","TCP","1514","80  >  49437 [ACK] Seq=20326 Ack=568 Win=64240 Len=1460 [TCP segment of a reassembled PDU]"
"220","7.484304","0.000225","82.150.140.30","172.16.165.165","TCP","1514","80  >  49437 [ACK] Seq=21786 Ack=568 Win=64240 Len=1460 [TCP segment of a reassembled PDU]"
"221","7.484305","0.000001","82.150.140.30","172.16.165.165","TCP","1199","80  >  49437 [PSH, ACK] Seq=23246 Ack=568 Win=64240 Len=1145 [TCP segment of a reassembled PDU]"
"222","7.484305","0.000000","82.150.140.30","172.16.165.165","TCP","60","80  >  49438 [SYN, ACK] Seq=0 Ack=1 Win=64240 Len=0 MSS=1460"
"223","7.484317","0.000012","172.16.165.165","82.150.140.30","TCP","54","49437  >  80 [ACK] Seq=568 Ack=24391 Win=64240 Len=0"
"224","7.484384","0.000067","172.16.165.165","82.150.140.30","TCP","54","49438  >  80 [ACK] Seq=1 Ack=1 Win=64240 Len=0"
"225","7.484572","0.000188","172.16.165.165","82.150.140.30","HTTP","432","GET /wp-content/themes/cini/style.css HTTP/1.1 "
"226","7.485952","0.001380","82.150.140.30","172.16.165.165","TCP","60","80  >  49438 [ACK] Seq=1 Ack=379 Win=64240 Len=0"
"227","7.494243","0.008291","82.150.140.30","172.16.165.165","TCP","1409","80  >  49437 [PSH, ACK] Seq=24391 Ack=568 Win=64240 Len=1355 [TCP segment of a reassembled PDU]"
"228","7.494729","0.000486","82.150.140.30","172.16.165.165","TCP","1409","80  >  49437 [PSH, ACK] Seq=25746 Ack=568 Win=64240 Len=1355 [TCP segment of a reassembled PDU]"
"229","7.494730","0.000001","82.150.140.30","172.16.165.165","TCP","60","80  >  49439 [SYN, ACK] Seq=0 Ack=1 Win=64240 Len=0 MSS=1460"
"230","7.494730","0.000000","82.150.140.30","172.16.165.165","TCP","60","80  >  49440 [SYN, ACK] Seq=0 Ack=1 Win=64240 Len=0 MSS=1460"
"231","7.494730","0.000000","82.150.140.30","172.16.165.165","TCP","60","80  >  49442 [SYN, ACK] Seq=0 Ack=1 Win=64240 Len=0 MSS=1460"
"232","7.494730","0.000000","82.150.140.30","172.16.165.165","TCP","60","80  >  49441 [SYN, ACK] Seq=0 Ack=1 Win=64240 Len=0 MSS=1460"
"233","7.494742","0.000012","172.16.165.165","82.150.140.30","TCP","54","49437  >  80 [ACK] Seq=568 Ack=27101 Win=64240 Len=0"
"234","7.494809","0.000067","172.16.165.165","82.150.140.30","TCP","54","49439  >  80 [ACK] Seq=1 Ack=1 Win=64240 Len=0"
"235","7.494836","0.000027","172.16.165.165","82.150.140.30","TCP","54","49440  >  80 [ACK] Seq=1 Ack=1 Win=64240 Len=0"
"236","7.494855","0.000019","172.16.165.165","82.150.140.30","TCP","54","49442  >  80 [ACK] Seq=1 Ack=1 Win=64240 Len=0"
"237","7.494878","0.000023","172.16.165.165","82.150.140.30","TCP","54","49441  >  80 [ACK] Seq=1 Ack=1 Win=64240 Len=0"
"238","7.495119","0.000241","172.16.165.165","82.150.140.30","HTTP","467","GET /wp-content/plugins/contact-form-7/includes/css/styles.css?ver=3.7.2 HTTP/1.1 "
"239","7.495234","0.000115","82.150.140.30","172.16.165.165","TCP","60","80  >  49439 [ACK] Seq=1 Ack=414 Win=64240 Len=0"
"240","7.495288","0.000054","172.16.165.165","82.150.140.30","HTTP","453","GET /wp-includes/js/jquery/jquery-migrate.min.js?ver=1.2.1 HTTP/1.1 "
"241","7.495418","0.000130","82.150.140.30","172.16.165.165","TCP","60","80  >  49440 [ACK] Seq=1 Ack=400 Win=64240 Len=0"
"242","7.495489","0.000071","172.16.165.165","82.150.140.30","HTTP","452","GET /wp-content/plugins/sitemap/css/page-list.css?ver=4.2 HTTP/1.1 "
"243","7.495622","0.000133","172.16.165.165","82.150.140.30","HTTP","438","GET /wp-content/themes/cini/js/functions.js HTTP/1.1 "
"244","7.495689","0.000067","82.150.140.30","172.16.165.165","TCP","60","80  >  49441 [ACK] Seq=1 Ack=399 Win=64240 Len=0"
"245","7.495753","0.000064","82.150.140.30","172.16.165.165","TCP","60","80  >  49442 [ACK] Seq=1 Ack=385 Win=64240 Len=0"
"246","7.532368","0.036615","204.79.197.200","172.16.165.165","TCP","60","[TCP Retransmission] 80  >  49433 [SYN, ACK] Seq=0 Ack=1 Win=64240 Len=0 MSS=1460"
"247","7.532370","0.000002","204.79.197.200","172.16.165.165","TCP","60","[TCP Retransmission] 80  >  49432 [SYN, ACK] Seq=0 Ack=1 Win=64240 Len=0 MSS=1460"
"248","7.581237","0.048867","172.16.165.2","172.16.165.165","DNS","87","Standard query response 0x799d A adultbiz.in A 185.53.178.9"
"249","7.581648","0.000411","172.16.165.165","185.53.178.9","TCP","66","49443  >  80 [SYN] Seq=0 Win=8192 Len=0 MSS=1460 WS=4 SACK_PERM=1"
"250","7.635690","0.054042","204.79.197.200","172.16.165.165","TCP","60","[TCP Retransmission] 80  >  49433 [SYN, ACK] Seq=0 Ack=1 Win=64240 Len=0 MSS=1460"
"251","7.635690","0.000000","204.79.197.200","172.16.165.165","TCP","60","[TCP Retransmission] 80  >  49432 [SYN, ACK] Seq=0 Ack=1 Win=64240 Len=0 MSS=1460"
"252","7.734083","0.098393","204.79.197.200","172.16.165.165","TCP","60","[TCP Retransmission] 80  >  49433 [SYN, ACK] Seq=0 Ack=1 Win=64240 Len=0 MSS=1460"
"253","7.734084","0.000001","204.79.197.200","172.16.165.165","TCP","60","[TCP Retransmission] 80  >  49432 [SYN, ACK] Seq=0 Ack=1 Win=64240 Len=0 MSS=1460"
"254","7.761300","0.027216","82.150.140.30","172.16.165.165","TCP","1409","80  >  49437 [PSH, ACK] Seq=27101 Ack=568 Win=64240 Len=1355 [TCP segment of a reassembled PDU]"
"255","7.761883","0.000583","82.150.140.30","172.16.165.165","TCP","1409","80  >  49437 [PSH, ACK] Seq=28456 Ack=568 Win=64240 Len=1355 [TCP segment of a reassembled PDU]"
"256","7.761901","0.000018","172.16.165.165","82.150.140.30","TCP","54","49437  >  80 [ACK] Seq=568 Ack=29811 Win=64240 Len=0"
"257","7.768202","0.006301","82.150.140.30","172.16.165.165","TCP","1409","80  >  49437 [PSH, ACK] Seq=29811 Ack=568 Win=64240 Len=1355 [TCP segment of a reassembled PDU]"
"258","7.768614","0.000412","82.150.140.30","172.16.165.165","TCP","1514","80  >  49437 [ACK] Seq=31166 Ack=568 Win=64240 Len=1460 [TCP segment of a reassembled PDU]"
"259","7.768615","0.000001","82.150.140.30","172.16.165.165","TCP","1304","80  >  49437 [PSH, ACK] Seq=32626 Ack=568 Win=64240 Len=1250 [TCP segment of a reassembled PDU]"
"260","7.768631","0.000016","172.16.165.165","82.150.140.30","TCP","54","49437  >  80 [ACK] Seq=568 Ack=33876 Win=64240 Len=0"
"261","7.834060","0.065429","204.79.197.200","172.16.165.165","TCP","60","[TCP Retransmission] 80  >  49433 [SYN, ACK] Seq=0 Ack=1 Win=64240 Len=0 MSS=1460"
"262","7.834060","0.000000","204.79.197.200","172.16.165.165","TCP","60","[TCP Retransmission] 80  >  49432 [SYN, ACK] Seq=0 Ack=1 Win=64240 Len=0 MSS=1460"
"263","7.867007","0.032947","82.150.140.30","172.16.165.165","TCP","1409","80  >  49437 [PSH, ACK] Seq=33876 Ack=568 Win=64240 Len=1355 [TCP segment of a reassembled PDU]"
"264","7.933980","0.066973","204.79.197.200","172.16.165.165","TCP","60","[TCP Retransmission] 80  >  49433 [SYN, ACK] Seq=0 Ack=1 Win=64240 Len=0 MSS=1460"
"265","7.933981","0.000001","204.79.197.200","172.16.165.165","TCP","60","[TCP Retransmission] 80  >  49432 [SYN, ACK] Seq=0 Ack=1 Win=64240 Len=0 MSS=1460"
"266","7.948070","0.014089","82.150.140.30","172.16.165.165","TCP","1409","80  >  49437 [PSH, ACK] Seq=35231 Ack=568 Win=64240 Len=1355 [TCP segment of a reassembled PDU]"
